,CO_mean,HUMID_mean,NEPH_mean,NO_mean,NO2_mean,OZONE_mean,SO2_mean,PM10_mean,PM2.5_mean,RAIN_sum,TEMP_min,TEMP_max,WSP_max,SD1_mean,WDR_mean,heavy_vehicle,light_vehicle,public_holiday,school_holiday,forecast,CO,OZONE,PM10,PM2.5,SO2,overall
2024-10-31,0.18259021639823914,68.39216666666667,0.3632916666666666,0.13580933213233948,0.6221021413803101,2.3073582649230957,0.07428745925426483,16.381717681884766,6.99636173248291,9.0,10.689497716894977,25.0,6.94,32.35879166666667,90.0,1014.3834228515625,15866.3310546875,0.0,0.0,"Sunny morning. High chance of showers, most likely during this afternoon and evening. The chance of a thunderstorm during this afternoon and evening. Light winds becoming south to southeasterly 15 to 25 km/h in the middle of the day then becoming light in the late evening.",Good,Good,Good,Good,Good,Good
2024-11-01,0.17892754077911377,68.39216666666667,0.3632916666666666,0.30366751551628113,0.6904217600822449,2.0869688987731934,0.07045038044452667,12.417909622192383,6.0052809715271,3.0,16.0,23.0,5.56,32.35879166666667,180.0,981.158447265625,15454.443359375,0.0,0.0,Partly cloudy. Medium chance of showers. Winds southerly 15 to 20 km/h becoming light early in the morning then becoming southeasterly 15 to 25 km/h in the early afternoon.,Good,Good,Good,Good,Good,Good
2024-11-02,0.18136215209960938,68.39216666666667,0.3632916666666666,0.5090793371200562,0.8005681037902832,1.8546658754348755,0.06718935072422028,10.012819290161133,5.04731559753418,1.0,15.0,22.0,5.56,32.35879166666667,90.0,965.9273681640625,14847.6787109375,0.0,0.0,Cloudy. Medium chance of showers in the morning and afternoon. Winds southeasterly 15 to 20 km/h shifting north to northeasterly 15 to 25 km/h during the afternoon.,Good,Good,Good,Good,Good,Good
2024-11-03,0.1860976219177246,68.39216666666667,0.3632916666666666,0.6539461612701416,0.9009016752243042,1.736283540725708,0.06617313623428345,8.960833549499512,4.743743419647217,0.0,16.0,30.0,6.94,32.35879166666667,0.0,971.3455200195312,14188.5712890625,0.0,0.0,Mostly sunny. Light winds becoming northerly 15 to 25 km/h during the morning then becoming light during the evening.,Good,Good,Good,Good,Good,Good
2024-11-04,0.19608211517333984,68.39216666666667,0.3632916666666666,0.7493627071380615,0.9693751335144043,1.6447376012802124,0.06671347469091415,8.814042091369629,4.541695594787598,1.0,19.0,25.0,5.56,32.35879166666667,225.0,996.4779052734375,13636.2216796875,0.0,0.0,Partly cloudy. Medium chance of showers. The chance of a thunderstorm. Winds southwesterly 15 to 20 km/h turning southeasterly 15 to 25 km/h during the morning.,Good,Good,Good,Good,Good,Good
2024-11-05,0.20178332924842834,68.39216666666667,0.3632916666666666,0.7651177048683167,0.9995667338371277,1.6217944622039795,0.06378806382417679,8.344614028930664,4.5330810546875,1.0,18.0,24.0,5.56,32.35879166666667,90.0,1035.394287109375,13317.2275390625,0.0,0.0,"Cloudy. Medium chance of showers, most likely during the morning. The chance of a thunderstorm. Light winds becoming easterly 15 to 20 km/h during the day.",Good,Good,Good,Good,Good,Good
2024-11-06,0.20720088481903076,68.39216666666667,0.3632916666666666,0.7302576899528503,1.0278851985931396,1.7021619081497192,0.06350583583116531,8.11960506439209,5.1591715812683105,0.0,18.0,27.0,5.56,32.35879166666667,45.0,1077.99609375,13284.9052734375,0.0,0.0,Partly cloudy. Slight chance of a shower. Light winds becoming northeasterly 15 to 20 km/h during the day.,Good,Good,Good,Good,Good,Good
